{
  "schemaVersion": "1.0.0",
  "documentId": "layout:00-source:semantic:tagging",
  "source": {
    "semanticDocumentId": "layout:00-source:semantic",
    "filePath": "C:\\Users\\tabur\\PDFIsAbsurd\\OpenAutoTag\\tmp\\calibration-corpus\\pipeline-artifacts\\un-sc-arabic\\00-source.pdf",
    "headingNormalization": {
      "applied": true,
      "totalHeadingCount": 2,
      "adjustedHeadingCount": 1,
      "firstDetectedHeading": "H2",
      "maxNormalizedHeading": "H1",
      "adjustments": [
        {
          "nodeId": "n-1-1",
          "text": "A",
          "from": "H2",
          "to": "H1"
        }
      ]
    },
    "tableRegularityCorrection": {
      "applied": false,
      "algorithm": "grid-normalization-v1",
      "tablesInspected": 0,
      "correctedTables": 0,
      "repairedRowCount": 0,
      "insertedPlaceholderCellCount": 0,
      "insertedSyntheticRowCount": 0,
      "shiftedCellCount": 0
    },
    "tableStructureRepairs": 0,
    "repeatedHeaderRows": 0
  },
  "root": {
    "id": "tag:document",
    "type": "Document",
    "children": [
      {
        "id": "tag:n-1-2",
        "type": "P",
        "label": "األمــم المتحـدة /RES/78/205 Distr.: General 22 December 2023",
        "sourceNodeIds": [
          "n-1-2"
        ],
        "children": []
      },
      {
        "id": "tag:section:n-1-1",
        "type": "Sect",
        "children": [
          {
            "id": "tag:n-1-1",
            "type": "H1",
            "label": "A",
            "sourceNodeIds": [
              "n-1-1"
            ],
            "children": [],
            "detectedType": "H2",
            "detectedHeadingLevel": 2
          }
        ]
      },
      {
        "id": "tag:section:n-1-4",
        "type": "Sect",
        "children": [
          {
            "id": "tag:n-1-4",
            "type": "H1",
            "label": "الجمعية العامة",
            "sourceNodeIds": [
              "n-1-4"
            ],
            "children": []
          },
          {
            "id": "tag:n-1-7",
            "type": "P",
            "label": "ة الثامنة والسبعونالدور (ب) من جدول األعمال 71 البند تعزيز حقوق اإلنسااان وحماها:ام مساااقو حقوق اإلنسااان بما في ذلك الن:ج البدهلة لاحساااااتم الاماع البعلي بحقوق األساسية اإلنسان والحريات",
            "sourceNodeIds": [
              "n-1-7"
            ],
            "children": []
          },
          {
            "id": "tag:n-1-12",
            "type": "P",
            "label": "2023 كانون األول/ديسمبر 19 ار اتخذته الجمعية العامة فيقر",
            "sourceNodeIds": [
              "n-1-12"
            ],
            "children": []
          },
          {
            "id": "tag:n-1-13",
            "type": "P",
            "label": "])139 ة، الفقر [بناء على تقرير اللجنة الثالثة ( A/78/481/Add.2",
            "sourceNodeIds": [
              "n-1-13"
            ],
            "children": []
          },
          {
            "id": "tag:n-1-16",
            "type": "P",
            "label": "توفتر الحماية والمساعدة للمشردهم داخليا -205/78",
            "sourceNodeIds": [
              "n-1-16"
            ],
            "children": []
          },
          {
            "id": "tag:n-1-17",
            "type": "P",
            "label": "،إن الجمعية العامة إذ تسارشد بمقاصد ميثاق األمم المتحدة ومبادئه، وإذ تشاتر إلى أن المشـردنن داللاا أخـصاأ أو مجماعام من األخـصاأ اوـ روا أو أجبروا على ا م عن أو اال معــــــلهم أو أماكن إقامتهم المعتادة، بصــــــفة لاصــــــة متاجة لنحة ديارار أو على مغادرالفر ها،ثار با اة أو طااري من بعر البشــــــر، أو دــــــ اا إلى تفاد عام أو امتهاكام لحقاق اإلمعــــــان أو طااري",
            "sourceNodeIds": [
              "n-1-17"
            ],
            "children": []
          },
          {
            "id": "tag:n-1-24",
            "type": "P",
            "label": "،)1(دود دولة معتربا بها دولاا ولم يعبروا عاب بالوإذ تشااعر بانز اء ا زدياد المثير للقلق بي عدد المشــردنن داللاا بي جماأ أمحاء العالم،إز اعام المعـــــــلحةقاق اإلمعـــــــان وامتهاكام القامان الدولي اإلمعـــــــامي والنح امألدـــــــباب منها امتهاكام وتجاوز رهاب، وطكلا الاااري ال با اة والاااري التي هي من بعو منها اإلر، وأدــــــــــــباب ألر وا وــــــــــــ هاد والعن ة التي تااجها تدرت التحديام الص يريحصــــــــلان على ما يافي من الحماية والمعــــــــاعدة، و البشــــــــر، الكنن",
            "sourceNodeIds": [
              "n-1-24"
            ],
            "children": []
          },
          {
            "id": "tag:n-1-30",
            "type": "P",
            "label": "اء الا،المجتمعام المضافة والعل ام الا ناة والمحلاة والمجتمأ الدولي من جر",
            "sourceNodeIds": [
              "n-1-30"
            ],
            "children": []
          },
          {
            "id": "tag:n-1-31",
            "type": "P",
            "label": "__________ .2 ة، المربق)، المقدمة، الفقرE/CN.4/1998/53/Add.2امظر المبادئ التاجيهاة بشأن التشريد الداللي ()1(",
            "sourceNodeIds": [
              "n-1-31"
            ],
            "children": []
          },
          {
            "id": "tag:n-1-33",
            "type": "P",
            "label": "23-26026 (A) *2326026*",
            "sourceNodeIds": [
              "n-1-33"
            ],
            "children": []
          },
          {
            "id": "tag:n-2-1",
            "type": "P",
            "label": "توفتر الحماية والمساعدة للمشردهم داخليا A/RES/78/205",
            "sourceNodeIds": [
              "n-2-1"
            ],
            "children": []
          },
          {
            "id": "tag:n-2-3",
            "type": "P",
            "label": "وإذ تشاااااتر مااماة أن نلتمإلى العدد الابير جدا لألخــــــــصاأ المشــــــــردنن دالر الحدود الا ناة و الحاجة إلى التفاير ا تجو طججيين أو مهاجرين، وهؤ ء األخــــــصاأ الحماية والمعــــــاعدة بي بلدان ألر الصـــــــدد، اتاجاام بعالة لضـــــــمان تابير ما يافي من الحماية والمعـــــــاعدة للمشـــــــردنن داللاا بي هكابي ادـــــــتر ا م التشريد هكه والحد منها، و ترمي إلى منأبي الا الحاجة إلى باامام خاملة ومصنفة وتدابير ألر بما",
            "sourceNodeIds": [
              "n-2-3"
            ],
            "children": []
          },
          {
            "id": "tag:n-2-8",
            "type": "P",
            "label": "وإذ تعتاد تايدتاد والمبـادئ 1991 طـامان األول/ديعــــــــــــــمبر 19 خالمؤر 182/46 ار الجم اـة العـامـةقر و اام الصــــــــلةوا جتماعي األلر ا قتصــــــــاد ام الجم اة العامة والمجلارالتاجيهاة الااردة بي مربقه وقر اهةام مبادئ اإلمعــــــــــــاماة والحااد والنحا تعيد أيضــــــــــــا تأكيد أهماة ا ترالمتفق عليها، و وادــــــــــــتنتاجام المجل ة أن تعحز جماأ الجهام الفاعلةا تعيد طكلا تأكيد وـــــــــرورم المعـــــــــاعدة اإلمعـــــــــاماة، ووا دـــــــــتقجل بي تقدي ئ المعقدة والاااري ال با اة هكه المبادئ وأنا م ال اار يطة بي تقديم المعــــــــــاعدة اإلمعــــــــــاماة بيالمشــــــــــار",
            "sourceNodeIds": [
              "n-2-8"
            ],
            "children": []
          },
          {
            "id": "tag:n-2-14",
            "type": "P",
            "label": "اما تاما،تحترمها ا تر وإذ تشااااادد على أن الدول تتحمر المعـــــــؤولاة بي المقام األول عن تابير الحماية للمشـــــــردنن داللاا الصاوــــعين لا نتها وتقديم المعــــاعدة لهم، دون تمييح، وطكلا عن معالجة األدــــباب الجكرية لمشــــالة التشــــرد ة لهم، والمجتمأمأ المشـردنن، والجهام المعـتضـاف ودعم جماأ الحلال الدائمة بالتعاون على النحا المنادـ",
            "sourceNodeIds": [
              "n-2-14"
            ],
            "children": []
          },
          {
            "id": "tag:n-2-19",
            "type": "P",
            "label": "المدمي، والعل ام المحلاة، والجهام الفاعلة بي مجال التنماة، والق اال الصاأ، والمجتمأ الدولي، وإذ تعرب عم القلق بشكو خاص يعامي منه المشردون داللاا، بمن اء زيادة معتاو التمييح الكإز بشـــار لاأ، ومن بينهم النعـــاء واأل فال والمعـــنان واألخـــصاأ ا م الضـــع بيهم الكنن قد يعامان من لى أقلاام دنناة ولغاية،اوو اإلعاقة والشـــــعاب األصـــــلاة واألخـــــصاأ المنتمان إلى أقلاام قاماة أو إثناة و مااماةريق تابير ما يافي من الحماية و دد على الحاجة إلى وـــمان تلباة ا تااجاتهم الصاصـــة عنا تشـــو",
            "sourceNodeIds": [
              "n-2-19"
            ],
            "children": []
          },
          {
            "id": "tag:n-2-25",
            "type": "P",
            "label": "الحصال على المعاعدة، وإذ تعرب عم أشاااد القلق ارتفاال معـــــتايام امعدام األمن الغكائي ودـــــاء التغكية على الصـــــعيد من بأن ا تعـــــــلماند مصا ر المجاعة، وبقدان دـــــــبر ال اا، والثار والمصا ر المتصـــــــلة بالتشـــــــرد، والعالمي وتح",
            "sourceNodeIds": [
              "n-2-25"
            ],
            "children": []
          },
          {
            "id": "tag:n-2-29",
            "type": "P",
            "label": "اجة مادة إلى بكل محيد من الجهاد، بما بي الا الدعم الدولي، لمعالجة هكه الحالة، هنات وإذ تالحظ الحاجة إلى معالجة األدـــباب الجكرية للتشـــرد وزيادة الاعي لدو المجتمأ الدولي بمعـــألة ال ا م تشـــــرد التشـــــرد الداللي بي جماأ أمحاء العالم، بما يشـــــمر أووـــــاال المجنين الكنن ي اشـــــان بي ابير ما يافيج المصامام وبي المنا ق الحضرية، والحاجة الملحة إلى تيث ي اا العدند منهم لار أمدها، لال من المعــاعدة اإلمعــاماة والحماية للمشــردنن داللاا، وطكلا النهال بالحلال الدائمة، بعــبر منها ووــأ",
            "sourceNodeIds": [
              "n-2-29"
            ],
            "children": []
          },
          {
            "id": "tag:n-2-35",
            "type": "P",
            "label": "معتدامة على الصعيد المحلي، وإذ تسال ا تشـير إلى أمه يمان الحد منالتشـرد، و بأن امتهاكام القامان الدولي اإلمعـامي قد تعـب دــــــــاما المبادئ اعام المعــــــــلحة القامان الدولي اإلمعــــــــامي، واا النحا م التشــــــــرد إاا ا ترمط جماأ أ ر المدميين ما لم يقتضي للعـاان ظر التشـريد القعـر والحا ة، وطكلا األدـادـاة المتمثلة بي التمييح والتنادـ",
            "sourceNodeIds": [
              "n-2-35"
            ],
            "children": []
          },
          {
            "id": "tag:n-2-40",
            "type": "P",
            "label": "،)2(الا أمن األخصاأ المدميين المعنيين أو أدباب ععارية قهرية",